Requirement ,Description ,Guidance,Testing
PCI 07.1.2,PCI 07.1.2: Restrict access to privileged user IDs to least privileges necessary to perform job responsibilities.,"When assigning privileged IDs, it is important to assign individuals only the privileges they need to perform their job (the “least privileges”). For example, the database administrator or backup administrator should not be assigned the same privileges as the overall systems administrator.

Assigning least privileges helps prevent users without sufficient knowledge about the application from incorrectly or accidentally changing application 
configuration or altering its security settings. Enforcing least privilege also helps to minimize the scope of damage if an unauthorized person gains access to a user ID. ","7.1.2.a Interview personnel responsible for assigning access to verify that access to privileged user IDs is: 

. Assigned only to roles that specifically require such 
privileged access 
. Restricted to least privileges necessary to perform job responsibilities. 

7.1.2.b Select a sample of user IDs with privileged access and interview responsible management personnel to verify that privileges assigned are: 

. Necessary for that individual’s job function 
. Restricted to least privileges necessary to perform job responsibilities."
PCI 07.1.3,PCI 07.1.3: Assign access based on individual personnel’s job classification and function.,"Once needs are defined for user roles (per PCI DSS requirement 7.1.1), it is easy to grant individuals access according to their job classification and function by using the already-created roles. ",7.1.3 Select a sample of user IDs and interview responsible management personnel to verify that privileges assigned are based on that individual’s job classification and function.
PCI 07.1.4,PCI 07.1.4: Require documented approval by authorized parties specifying required privileges.,"Documented approval (for example, in writing or electronically) assures that those with access and privileges are known and authorized by management, and that their access is necessary for their job function. ","7.1.4 Select a sample of user IDs and compare with documented approvals to verify that: 

. Documented approval exists for the assigned privileges 
. The approval was by authorized parties 
. That specified privileges match the roles assigned to the individual. "
PCI 07.2,"PCI 07.2: Establish an access control system for systems components that restricts access based on a user’s need to know, and is set to “deny all” unless specifically allowed. This access control system must include the following:","Without a mechanism to restrict access based on user’s need to know, a user may unknowingly be granted access to cardholder data. An access control system automates the process of restricting access and assigning privileges. Additionally, a default “deny-all” setting ensures no one is granted access until and unless a rule is established specifically granting such access. 

Note: Some access control systems are set by default to “allow-all,” thereby permitting access unless/until a rule is written to specifically deny it.",7.2 Examine system settings and vendor documentation to verify that an access control system is implemented as follows:
PCI 07.2.1,PCI 07.2.1: Coverage of all system components,,7.2.1 Confirm that access control systems are in place on all system components.
PCI 07.2.2,PCI 07.2.2: Assignment of privileges to individuals based on job classification and function.,,7.2.2 Confirm that access control systems are configured to enforce privileges assigned to individuals based on job classification and function.
PCI 07.2.3,PCI 07.2.3: Default “deny-all” setting.,,7.2.3 Confirm that the access control systems have a default “deny-all” setting.
PCI 07.3,"PCI 07.3: Ensure that security policies and operational procedures for restricting access to cardholder data are documented, in use, and known to all affected parties.","Personnel need to be aware of and following security policies and operational procedures to ensure that access is controlled and based on need-to-know and least privilege, on a continuous basis.","7.3 Examine documentation interview personnel to verify that security policies and operational procedures for restricting access to cardholder data are: 

. Documented, 
. In use, and 
. Known to all affected parties. "
PCI 08,PCI 08: Identify and authenticate access to system components,,
PCI 08.1,PCI 08.1: Define and implement policies and procedures to ensure proper user identification management for non-consumer users and administrators on all system components as follows:,By ensuring each user is uniquely identified—instead of using one ID for several employees—an organization can maintain individual responsibility for actions and an effective audit trail per employee. This will help speed issue resolution and containment when misuse or malicious intent occurs.,"8.1.a Review procedures and confirm they define processes for each of the items below at 8.1.1 through 8.1.8

8.1.b Verify that procedures are implemented for user identification management, by performing the following: "
PCI 08.1.1,PCI 08.1.1: Assign all users a unique ID before allowing them to access system components or cardholder data.,,8.1.1 Interview administrative personnel to confirm that all users are assigned a unique ID for access to system components or cardholder data.
PCI 08.1.2,"PCI 08.1.2: Control addition, deletion, and modification of user IDs, credentials, and other identifier objects.","To ensure that user accounts granted access to systems are all valid and recognized users, strong processes must manage all changes to user IDs and other authentication credentials, including adding 
new ones and modifying or deleting existing ones. ","8.1.2 For a sample of privileged user IDs and general user IDs, examine associated authorizations and observe system settings to verify each user ID and privileged user ID has been implemented with only the privileges specified on the documented approval. "
PCI 08.1.3,PCI 08.1.3: Immediately revoke access for any terminated users.,"If an employee has left the company and still has access to the network via their user account, unnecessary or malicious access to cardholder data could occur—either by the former employee or by a malicious user who exploits the old and/or unused 
account. To prevent unauthorized access, user credentials and other authentication methods therefore need to be revoked promptly (as soon as possible) upon the employee’s departure. ","8.1.3.a Select a sample of users terminated in the past six months, and review current user access lists—for both local and remote access—to verify that their IDs have been deactivated or removed from the access lists. 

8.1.3.b Verify all physical authentication methods—such as, smart cards, tokens, etc.—have been returned or deactivated. "
PCI 08.1.4,PCI 08.1.4: Remove/disable inactive user accounts at least every 90: days.,"Accounts that are not used regularly are often targets of attack since it is less likely that any changes (such as a changed password) will be noticed. As such, these accounts may be more easily exploited and used to access cardholder data. ",8.1.4 Observe user accounts to verify that any inactive accounts over 90 days old are either removed or disabled.
PCI 08.1.5,"PCI 08.1.5: Manage IDs used by vendors to access, support, or maintain system components via remote access as follows: . Enabled only during the time period needed and disabled when not in use. . Monitored when in use.","llowing vendors to have 24/7 access into your network in case they need to support your systems increases the chances of unauthorized access, either from a user in the vendor’s environment or from a malicious individual who finds and uses this 
always-available external entry point into your network. Enabling access only for the time periods needed, and disabling it as soon as it is no longer needed, helps prevent misuse of these connections. 

Monitoring of vendor access provides assurance that vendors are accessing only the systems necessary and only during approved time frames.","8.1.5.a Interview personnel and observe processes for managing accounts used by vendors to access, support, or maintain system components to verify that accounts used by vendors for remote access are: 

. Disabled when not in use 
. Enabled only when needed by the vendor, and disabled when not in use. 

8.1.5.b Interview personnel and observe processes to verify that vendor remote access accounts are monitored while being used. "
PCI 08.1.6,PCI 08.1.6: Limit repeated access attempts by locking out the user ID after not more than six attempts.,"Without account-lockout mechanisms in place, an attacker can continually attempt to guess a password through manual or automated tools (for example, password cracking), until they achieve success and gain access to a user’s account. ","8.1.6.a For a sample of system components, inspect system configuration settings to verify that authentication parameters are set to require that user accounts be locked out after not more than six invalid logon attempts. 

8.1.6.b Additional testing procedure for service providers: Review internal processes and customer/user documentation, and observe implemented processes to verify that non-
consumer user accounts are temporarily locked-out after not more than six invalid access attempts. "
PCI 08.1.7,PCI 08.1.7: Set the lockout duration to a minimum of 30: minutes or until an administrator enables the user ID.,"If an account is locked out due to someone 
continually trying to guess a password, controls to delay reactivation of these locked accounts stops the malicious individual from continually guessing 
the password (they will have to stop for a minimum of 30 minutes until the account is reactivated). Additionally, if reactivation must be requested, the admin or help desk can validate that it is the actual account owner requesting reactivation.","8.1.7 For a sample of system components, inspect system configuration settings to verify that password parameters are set to require that once a user account is locked out, it remains locked for a minimum of 30 minutes or until a system 
administrator resets the account. "
PCI 08.1.8,"PCI 08.1.8: If a session has been idle for more than 15: minutes, require the user to re-authenticate to re-activate the terminal or session.","When users walk away from an open machine with access to critical system components or cardholder data, that machine may be used by others in the 
user’s absence, resulting in unauthorized account access and/or misuse. 

The re-authentication can be applied either at the system level to protect all sessions running on that machine, or at the application level. ","8.1.8 For a sample of system components, inspect system configuration settings to verify that system/session idle time out features have been set to 15 minutes or less. "
PCI 08.2,"PCI 08.2: In addition to assigning a unique ID, ensure proper user-authentication management for non-consumer users and administrators on all system components by employing at least one of the following methods to authenticate all users: . Something yo...","These authentication methods, when used in addition to unique IDs, help protect users’ IDs from being compromised, since the one attempting the compromise needs to know both the unique ID and the password (or other authentication used). Note that a digital certificate is a valid option for “something you have” as long as it is unique for a particular user. 

Since one of the first steps a malicious individual will take to compromise a system is to exploit weak or nonexistent passwords, it is important to implement good processes for authentication management","8.2 To verify that users are authenticated using unique ID and additional auth-entication (for example, a password / phrase) for access to the cardholder data environment, perform the 
following: 
. Examine documentation describing the authentication method(s) used. 
. For each type of authentication method used and for each type of system component, observe an authentication to verify authentication is functioning consistent with documented authentication method(s). "
PCI 08.2.1,"PCI 08.2.1: Using strong cryptography, render all authentication credentials (such as passwords/phrases) unreadable during transmission and storage on all system components.","Many network devices and applications transmit unencrypted, readable passwords across the network and/or store passwords without encryption. A malicious individual can easily intercept unencrypted passwords during transmission using a “sniffer,” or directly access unencrypted passwords 
in files where they are stored, and use this data to gain unauthorized access. ","8.2.1.a Examine vendor documentation and system 
configuration settings to verify that passwords are protected with strong cryptography during transmission and storage.

8.2.1.b For a sample of system components, examine 
password files to verify that passwords are unreadable during storage. 

8.2.1.c For a sample of system components, examine data transmissions to verify that passwords are unreadable during transmission. 

8.2.1.d Additional testing procedure for service providers: Observe password files to verify that customer passwords are unreadable during storage. 

8.2.1.e Additional testing procedure for service providers: Observe data transmissions to verify that customer passwords are unreadable during transmission."
PCI 08.2.2,"PCI 08.2.2: Verify user identity before modifying any authentication credential—for example, performing password resets, provisioning new tokens, or generating new keys.","Many malicious individuals use ""social 
engineering”—for example, calling a help desk and acting as a legitimate user—to have a password changed so they can utilize a user ID. Consider use of a “secret question” that only the proper user can 
answer to help administrators identify the user prior to re-setting or modifying authentication credentials.","8.2.2 Examine authentication procedures for modifying authentication credentials and observe security personnel to verify that, if a user requests a reset of an authentication credential by phone, e-mail, web, or other non-face-to-face method, the user’s identity is verified before the authentication 
credential is modified. "
PCI 08.2.3,"PCI 08.2.3: Passwords/phrases must meet the following: . Require a minimum length of at least seven characters. . Contain both numeric and alphabetic characters. Alternatively, the passwords/phrases must have complexity and strength at least equivalent to","Strong passwords/phrases are the first line of defense into a network since a malicious individual will often first try to find accounts with weak or non-existent passwords. If passwords are short or simple 
to guess, it is relatively easy for a malicious 
individual to find these weak accounts and 
compromise a network under the guise of a valid user ID. 

This requirement specifies that a minimum of seven characters and both numeric and alphabetic characters should be used for passwords/phrases. For cases where this minimum cannot be met due to 
technical limitations, entities can use “equivalent strength” to evaluate their alternative. NIST SP 800-63-1 defines “entropy” as “a measure of the difficulty 
of guessing or determining a password or key.” This document and others that discuss “password entropy” can be referred to for more information on applicable entropy value and for understanding equivalent password strength variability for 
passwords/phrases of different formats. ","8.2.3a For a sample of system components, inspect system configuration settings to verify that user password parameters are set to require at least the following strength/complexity: 

. Require a minimum length of at least seven characters. 
. Contain both numeric and alphabetic characters. 

8.2.3.b Additional testing procedure for service providers: Review internal processes and customer/user documentation to verify that non-consumer user passwords are required to meet at least the following strength/complexity: 

. Require a minimum length of at least seven characters. 
. Contain both numeric and alphabetic characters. "
PCI 08.2.4,PCI 08.2.4: Change user passwords/passphrases at least every 90: days.,Passwords/phrases that are valid for a long time without a change provide malicious individuals with more time to work on breaking the password/phrase.,"8.2.4.a For a sample of system components, inspect system configuration settings to verify that user password parameters are set to require users to change passwords at least every 90 days. 

8.2.4.b Additional testing procedure for service providers: Review internal processes and customer/user documentation 
to verify that: 

. Non-consumer user passwords are required to change periodically; and 
. Non-consumer users are given guidance as to when, and under what circumstances, passwords must change. "
PCI 08.2.5,PCI 08.2.5: Do not allow an individual to submit a new password/phrase that is the same as any of the last four passwords/phrases he or she has used.,"If password history isn’t maintained, the effectiveness of changing passwords is reduced, as previous passwords can be reused over and over. Requiring that passwords cannot be reused for a period of time reduces the likelihood that passwords that have been guessed or brute-forced will be used in the future. ","8.2.5.a For a sample of system components, obtain and inspect system configuration settings to verify that password parameters are set to require that new passwords cannot be the same as the four previously used passwords. 

If password history isn’t maintained, the 
effectiveness of changing passwords is reduced, as previous passwords can be reused over and over. Requiring that passwords cannot be reused for a period of time reduces the likelihood that passwords that have been guessed or brute-forced will be used in the future. "
PCI 08.2.6,"PCI 08.2.6: Set passwords/phrases for first-time use and upon reset to a unique value for each user, and change immediately after the first use.","If the same password is used for every new user, an internal user, former employee, or malicious individual may know or easily discover this password, and use it to gain access to accounts. ","8.2.6 Examine password procedures and observe security personnel to verify that first-time passwords for new users, and reset passwords for existing users, are set to a unique value for each user and changed after first use. "
PCI 08.3,"PCI 08.3: Incorporate two-factor authentication for remote network access originating from outside the network by personnel (including users and administrators) and all third parties, (including vendor access for support or maintenance). Note: Two-fact...","Two-factor authentication requires two forms of authentication for higher-risk accesses, such as those originating from outside the network 

This requirement is intended to apply to all personnel—including general users, administrators, and vendors (for support or maintenance) with remote access to the network—where that remote access could lead to access to the cardholder data 
environment. 

If remote access is to an entity’s network that has appropriate segmentation, such that remote users cannot access or impact the cardholder data environment, two-factor authentication for remote access to that network would not be required.  However, two-factor authentication is required for any remote access to networks with access to the cardholder data environment, and is recommended for all remote access to the entity’s networks. ","8.3.a Examine system configurations for remote access servers and systems to verify two-factor authentication is required for: 

. All remote access by personnel 
. All third-party/vendor remote access (including access to applications and system components for support or maintenance purposes).

8.3.b Observe a sample of personnel (for example, users and administrators) connecting remotely to the network and verify that at least two of the three authentication methods are used. "
PCI 08.4,PCI 08.4: Document and communicate authentication procedures and policies to all users including: . Guidance on selecting strong authentication credentials . Guidance for how users should protect their authentication credentials . Instructions not to reu,"Communicating password / authentication procedures to all users helps those users understand and abide by the policies. 

For example, guidance on selecting strong passwords may include suggestions to help personnel select hard-to-guess passwords that don’t contain dictionary words, and that don’t contain information about the user (such as the user ID, names of family members, date of birth, etc.). 
Guidance for protecting authentication credentials 
may include not writing down passwords or saving them in insecure files, and being alert for malicious 
individuals who may attempt to exploit their passwords (for example, by calling an employee and asking for their password so the caller can 
“troubleshoot a problem”). 

Instructing users to change passwords if there is a chance the password is no longer secure can prevent malicious users from using a legitimate password to gain unauthorized access. ","8.4.a Examine procedures and interview personnel to verify that authentication procedures and policies are distributed to all users.

8.4.b Review authentication procedures and policies that are distributed to users and verify they include: 

. Guidance on selecting strong authentication credentials 
. Guidance for how users should protect their authentication credentials. 
. Instructions for users not to reuse previously used passwords 
. Instructions to change passwords if there is any suspicion the password could be compromised. 


8.4.c Interview a sample of users to verify that they are familiar with authentication procedures and policies. 
"
PCI 08.5,"PCI 08.5: Do not use group, shared, or generic IDs, passwords, or other authentication methods as follows: . Generic user IDs are disabled or removed. . Shared user IDs do not exist for system administration and other critical functions. . Shared and g...","If multiple users share the same authentication credentials (for example, user account and password), it becomes impossible to trace system access and activities to an individual. This in turn prevents an entity from assigning accountability for, or having effective logging of, an individual’s actions, since a given action could have been performed by anyone in the group that has knowledge of the authentication credentials. ","8.5 Do not use group, shared, or generic IDs, passwords, or other authentication methods as follows: 

. Generic user IDs are disabled or removed. 
. Shared user IDs do not exist for system administration and other critical functions. 
. Shared and generic user IDs are not used to administer any system components. 

8.5.b Examine authentication policies/procedures to verify that use of group and shared IDs and/or passwords or other authentication methods are explicitly prohibited. 

8.5.c Interview system administrators to verify that group and shared IDs and/or passwords or other authentication methods are not distributed, even if requested. "
PCI 08.5.1,"PCI 08.5.1: Additional requirement for service providers: Service providers with remote access to customer premises (for example, for support of POS systems or servers) must use a unique authentication credential (such as a password/phrase) for each cu...","To prevent the compromise of multiple customers through the use of a single set of credentials, vendors with remote access accounts to customer environments should use a different authentication credential for each customer. 

Technologies, such as two-factor mechanisms, that provide a unique credential for each connection (for 
example, via a single-use password) could also meet the intent of this requirement.",8.5.1 Additional testing procedure for service providers: Examine authentication policies and procedures and interview personnel to verify that different authentication are used for access to each customer.
