Requirement ,Description ,Guidance,Testing
PCI 01,PCI 01: Install and maintain a firewall configuration to protect cardholder data,,
PCI 01.1.1,PCI 01.1.1: A formal process for approving and testing all network connections and changes to the firewall and router configurations,"A documented and implemented process for approving and testing all connections and changes to the firewalls and routers will help prevent security problems caused by misconfiguration of the network, router, or firewall. 

Without formal approval and testing of changes, records of the changes might not be updated, which could lead to inconsistencies between network documentation and the actual 
configuration. ","1.1.1.a Examine documented procedures to verify there is a formal process for testing and approval of all: 

. Network connections and 
. Changes to firewall and router configurations 

1.1.1.b For a sample of network connections, interview responsible personnel and examine records to verify that network connections were approved and tested. 

1.1.1.c Identify a sample of actual changes made to firewall and router configurations, compare to the change records, and 
interview responsible personnel to verify the changes were approved and tested. "
PCI 01.1.2,"PCI 01.1.2: Current network diagram that identifies all connections between the cardholder data environment and other networks, including any wireless networks","Network diagrams describe how networks are configured, and identify the location of all network devices. 

Without current network diagrams, devices could be overlooked and be unknowingly left out of the security controls implemented for PCI DSS and 
thus be vulnerable to compromise.","1.1.2.a Examine diagram(s) and observe network configurations to verify that a current network diagram exists and that it documents all connections to cardholder data, including any wireless networks. 

1.1.2.b Interview responsible personnel to verify that the diagram is kept current."
PCI 01.1.3,PCI 01.1.3: Current diagram that shows all cardholder data flows across systems and networks,"Cardholder data-flow diagrams identify the location of all cardholder data that is stored, processed, or transmitted within the network. 

Network and cardholder data-flow diagrams help an organization to understand and keep track of 
the scope of their environment, by showing how cardholder data flows across networks and between individual systems and devices. ","1.1.3 Examine data-flow diagram and interview personnel to 
verify the diagram: 

. Shows all cardholder data flows across systems and networks. 
. Is kept current and updated as needed upon changes to the environment. "
PCI 01.1.4,PCI 01.1.4: Requirements for a firewall at each Internet connection and between any demilitarized zone (DMZ) and the internal network zone,"Using a firewall on every Internet connection coming into (and out of) the network, and between any DMZ and the internal network, allows the organization to monitor and control access and 
minimizes the chances of a malicious individual obtaining access to the internal network via an unprotected connection. ","1.1.4.a Examine the firewall configuration standards and verify that they include requirements for a firewall at each Internet 
connection and between any DMZ and the internal network zone. 

1.1.4.b Verify that the current network diagram is consistent with the firewall configuration standards. 

1.1.4.c Observe network configurations to verify that a firewall is in place at each Internet connection and between any 
demilitarized zone (DMZ) and the internal network zone, per the documented configuration standards and network 
diagrams. "
PCI 01.1.5,"PCI 01.1.5: Description of groups, roles, and responsibilities for management of network components","This description of roles and assignment of responsibilities ensures that personnel are aware of who is responsible for the security of all 
network components, and that those assigned to manage components are aware of their responsibilities. If roles and responsibilities are not formally assigned, devices could be left 
unmanaged. 
","1.1.5.a Verify that firewall and router configuration standards include a description of groups, roles, and responsibilities for management of network components. 

1.1.5.b Interview personnel responsible for management of network components to confirm that roles and responsibilities 
are assigned as documented. "
PCI 01.1.6,"PCI 01.1.6: Documentation and business justification for use of all services, protocols, and ports allowed, including documentation of security features implemented for those protocols considered to be insecure. Examples of insecure services, protocols","Compromises often happen due to unused or insecure service and ports, since these often have known vulnerabilities and many organizations don’t patch vulnerabilities for the services, protocols, and ports they don't use (even though the vulnerabilities are still present). By clearly defining and documenting the services, protocols, and ports that are necessary for business, organizations can ensure that all other services, protocols, and ports are disabled or removed. 

If insecure services, protocols, or ports are necessary for business, the risk posed by use of these protocols should be clearly understood and 
accepted by the organization, the use of the protocol should be justified, and the security features that allow these protocols to be used securely should be documented and implemented. If these insecure services, protocols, or ports are not necessary for business, 
they should be disabled or removed. ","1.1.6.a Verify that firewall and router configuration standards include a documented list of all services, protocols and ports, including business justification for each—for example, hypertext transfer protocol (HTTP) and Secure Sockets Layer 
(SSL), Secure Shell (SSH), and Virtual Private Network (VPN) protocols. 

1.1.6.b Identify insecure services, protocols, and ports allowed; and verify that security features are documented for 
each service. 

1.1.6.c Examine firewall and router configurations to verify that the documented security features are implemented for each insecure service, protocol, and port. "
PCI 01.1.7,PCI 01.1.7: Requirement to review firewall and router rule sets at least every six months,"This review gives the organization an opportunity at least every six months to clean up any unneeded, outdated, or incorrect rules, and ensure that all rule sets allow only authorized 
services and ports that match the documented business justifications. 

Organizations with a high volume of changes to firewall and router rule sets may wish to consider performing reviews more frequently, to ensure 
that the rule sets continue to meet the needs of the business. ","1.1.7.a Verify that firewall and router configuration standards require review of firewall and router rule sets at least every six months. 

1.1.7.b Examine documentation relating to rule set reviews and interview responsible personnel to verify that the rule sets 
are reviewed at least every six months. "
PCI 01.2.1,"PCI 01.2.1: Restrict inbound and outbound traffic to that which is necessary for the cardholder data environment, and specifically deny all other traffic.","This requirement is intended to prevent malicious individuals from accessing the entity’s network via 
unauthorized IP addresses or from using services, protocols, or ports in an unauthorized manner (for example, to send data they've obtained from 
within your network out to an untrusted server.) 

Implementing a rule that denies all inbound and outbound traffic that is not specifically needed helps to prevent inadvertent holes that would 
allow unintended and potentially harmful traffic in or out. ","1.2.1 Restrict inbound and outbound 
traffic to that which is necessary for the 
cardholder data environment, and 
specifically deny all other traffic. 

1.2.1.b Examine firewall and router configurations to verify that inbound and outbound traffic is limited to that which is 
necessary for the cardholder data environment. 

1.2.1.c Examine firewall and router configurations to verify that all other inbound and outbound traffic is specifically denied, for example by using an explicit “deny all” or an implicit deny after allow statement. "
PCI 01.2.2,PCI 01.2.2: Secure and synchronize router configuration files.,"While the running (or active) router configuration files include the current, secure settings, the startup files (which are used when routers are re-
started or booted) must be updated with the same secure settings to ensure these settings are applied when the start-up configuration is run. 

Because they only run occasionally, start-up configuration files are often forgotten and are not updated. When a router re-starts and loads a 
start-up configuration that has not been updated with the same secure settings as those in the running configuration, it may result in weaker rules that allow malicious individuals into the network. 
","1.2.2.a Examine router configuration files to verify they are secured from unauthorized access. 

1.2.2.b Examine router configurations to verify they are synchronized—for example, the running (or active) configuration matches the start-up configuration (used when machines are booted). "
PCI 01.2.3,"PCI 01.2.3: Install perimeter firewalls between all wireless networks and the cardholder data environment, and configure these firewalls to deny or, if traffic is necessary for business purposes, permit only authorized traffic between the wireless enviro","The known (or unknown) implementation and exploitation of wireless technology within a network is a common path for malicious 
individuals to gain access to the network and cardholder data. If a wireless device or network is 
installed without the entity’s knowledge, amalicious individual could easily and “invisibly” enter the network. If firewalls do not restrict 
access from wireless networks into the CDE, malicious individuals that gain unauthorized access to the wireless network can easily connect to the CDE and compromise account information. 

Firewalls must be installed between all wireless networks and the CDE, regardless of the purpose of the environment to which the wireless network is connected. This may include, but is not limited to, corporate networks, retail stores, guest networks, warehouse environments, etc. ","1.2.3.a Examine firewall and router configurations to verify that there are perimeter firewalls installed between all wireless networks and the cardholder data environment. 

1.2.3.b Verify that the firewalls deny or, if traffic is necessary for business purposes, permit only authorized traffic between 
the wireless environment and the cardholder data environment. "
PCI 01.3.1,"PCI 01.3.1: Implement a DMZ to limit inbound traffic to only system components that provide authorized publicly accessible services, protocols, and ports.","The DMZ is that part of the network that manages connections between the Internet (or other untrusted networks), and services that an 
organization needs to have available to the public (like a web server). 

This functionality is intended to prevent malicious individuals from accessing the organization's internal network from the Internet, or from using services, protocols, or ports in an unauthorized manner. ","1.3.1 Examine firewall and router configurations to verify that a DMZ is implemented to limit inbound traffic to only system components that provide authorized publicly accessible services, protocols, and ports. "
PCI 01.3.2,PCI 01.3.2: Limit inbound Internet traffic to IP addresses within the DMZ.,,"1.3.2 Examine firewall and router configurations to verify that 
inbound Internet traffic is limited to IP addresses within the 
DMZ. "
PCI 01.3.3,PCI 01.3.3: Do not allow any direct connections inbound or outbound for traffic between the Internet and the cardholder data environment.,"Examination of all inbound and outbound connections allows for inspection and restriction of 
traffic based on the source and/or destination address, as well as inspection and blocking of 
unwanted content, thus preventing unfiltered access between untrusted and trusted environments. This helps prevent, for example, malicious individuals from sending data they've 
obtained from within your network out to an external untrusted server in an untrusted network.","1.3.3 Examine firewall and router configurations to verify direct 
connections inbound or outbound are not allowed for traffic 
between the Internet and the cardholder data environment. "
PCI 01.3.4,"PCI 01.3.4: Implement anti-spoofing measures to detect and block forged source IP addresses from entering the network. (For example, block traffic originating from the Internet with an internal source address.)","Normally a packet contains the IP address of the computer that originally sent it so other computers 
in the network know where the packet came from. Malicious individuals will often try to spoof (or imitate) the sending IP address so that the target 
system believes the packet is from a trusted source. 

Filtering packets coming into the network helps to, among other things, ensure packets are not “spoofed” to look like they are coming from an 
organization’s own internal network. ","1.3.4 Examine firewall and router configurations to verify that anti-spoofing measures are implemented, for example internal addresses cannot pass from the Internet into the DMZ."
PCI 01.3.5,PCI 01.3.5: Do not allow unauthorized outbound traffic from the cardholder data environment to the Internet.,"All traffic outbound from the cardholder data environment should be evaluated to ensure that it 
follows established, authorized rules. Connections should be inspected to restrict traffic to only authorized communications (for example by 
restricting source/destination addresses/ports, and/or blocking of content). ",1.3.5 Examine firewall and router configurations to verify that outbound traffic from the cardholder data environment to the Internet is explicitly authorized.
PCI 01.3.6,"PCI 01.3.6: Implement stateful inspection, also known as dynamic packet filtering. (That is, only “established” connections are allowed into the network.)","A firewall that performs stateful packet inspection maintains the ""state"" (or the status) for each 
connection through the firewall. By maintaining the “state,” the firewall knows whether an apparent response to a previous connection is actually a valid, authorized response (since it 
retains each connection’s status) or is malicious traffic trying to trick the firewall into allowing the 
connection. ","1.3.6 Examine firewall and router configurations to verify that the firewall performs stateful inspection (dynamic packet filtering). (Only established connections should be allowed in, 
and only if they are associated with a previously established session.) "
PCI 01.3.7,"PCI 01.3.7: Place system components that store cardholder data (such as a database) in an internal network zone, segregated from the DMZ and other untrusted networks.","If cardholder data is located within the DMZ, it is easier for an external attacker to access this 
information, since there are fewer layers to penetrate. Securing system components that store cardholder data in an internal network zone 
that is segregated from the DMZ and other untrusted networks by a firewall can prevent unauthorized network traffic from reaching the 
system component. 

Note: This requirement is not intended to apply to temporary storage of cardholder data in volatile memory. ","1.3.7 Examine firewall and router configurations to verify that system components that store cardholder data are on an internal network zone, segregated from the DMZ and other untrusted networks. "
PCI 01.3.8,"PCI 01.3.8: Do not disclose private IP addresses and routing information to unauthorized parties. Note: Methods to obscure IP addressing may include, but are not limited to: . Network Address Translation (NAT) . Placing servers containing cardholder d","Restricting the disclosure of internal or private IP addresses is essential to prevent a hacker “learning” the IP addresses of the internal network, and using that information to access the 
network. 

Methods used to meet the intent of this requirement may vary depending on the specific networking technology being used. For example, the controls used to meet this requirement may be 
different for IPv4 networks than for IPv6 networks. ","1.3.8.a Examine firewall and router configurations to verify that methods are in place to prevent the disclosure of private IP addresses and routing information from internal networks to 
the Internet. 

1.3.8.b Interview personnel and examine documentation to verify that any disclosure of private IP addresses and routing information to external entities is authorized. "
PCI 02,PCI 02: Do not use vendor-supplied defaults for system passwords and other security parameters,,
PCI 02.1,"PCI 02.1: Always change vendor-supplied defaults and remove or disable unnecessary default accounts before installing a system on the network. This applies to ALL default passwords, including but not limited to those used by operating systems, software","Malicious individuals (external and internal to an organization) often use vendor default settings, account names, and passwords to compromise operating system software, applications, and the systems on which they are installed. Because these default settings are often published and are well known in hacker communities, changing these settings will leave systems less vulnerable to attack. 

Even if a default account is not intended to be used, changing the default password to a strong unique password and then disabling the account will prevent a malicious individual from re-enabling the account and gaining access with the default password. ","2.1.a Choose a sample of system components, and attempt to log on (with system administrator help) to the devices and applications using default vendor-supplied accounts and passwords, to verify that ALL default passwords (including those on operating systems, software that provides security services, application and system accounts, POS terminals, and Simple Network Management Protocol (SNMP) community strings) have been changed. (Use vendor manuals and sources on the Internet to find vendor-supplied accounts/passwords.) 

2.1.b For the sample of system components, verify that all unnecessary default accounts (including accounts used by operating systems, security software, applications, systems, POS terminals, SNMP, etc.) are removed or disabled. 

2.1.c Interview personnel and examine supporting documentation to verify that: 

. All vendor defaults (including default passwords on operating systems, software providing security services, application and system accounts, POS terminals, Simple Network Management Protocol (SNMP) community strings, etc.) are changed before a system is installed on the network. 
. Unnecessary default accounts (including accounts used by operating systems, security software, applications, systems, POS terminals, SNMP, etc.) are removed or disabled before B2 a system is installed on the network. "
PCI 02.1.1,"PCI 02.1.1: For wireless environments connected to the cardholder data environment or transmitting cardholder data, change ALL wireless vendor defaults at installation, including but not limited to default wireless encryption keys, passwords, and SNMP ...","If wireless networks are not implemented with sufficient security configurations (including changing default settings), wireless sniffers can eavesdrop on the traffic, easily capture data and passwords, and easily enter and attack the network. 

In addition, the key-exchange protocol for older versions of 802.11x encryption (Wired Equivalent Privacy, or WEP) has been broken and can render the encryption useless. Firmware for devices should be updated to support more secure protocols. ","2.1.1.a Interview responsible personnel and examine supporting documentation to verify that: 

. Encryption keys were changed from default at installation 
. Encryption keys are changed anytime anyone with knowledge of the keys leaves the company or changes positions. 

2.1.1.b Interview personnel and examine policies and procedures to verify: 

. Default SNMP community strings are required to be changed upon installation. 
. Default passwords/phrases on access points are required to be changed upon installation. 

2.1.1.c Examine vendor documentation and login to wireless devices, with system administrator help, to verify: 

. Default SNMP community strings are not used. 
. Default passwords/passphrases on access points are not used. 

2.1.1.d Examine vendor documentation and observe wireless configuration settings to verify firmware on wireless devices is updated to support strong encryption for: 

. Authentication over wireless networks 
. Transmission over wireless networks. 

2.1.1.e Examine vendor documentation and observe wireless configuration settings to verify other security-related wireless vendor defaults were changed, if applicable. "
PCI 02.2,PCI 02.2: Develop configuration standards for all system components. Assure that these standards address all known security vulnerabilities and are consistent with industry-accepted system hardening standards. Sources of industry-accepted system harden,"There are known weaknesses with many operating systems, databases, and enterprise applications, and there are also known ways to configure these systems to fix security 
vulnerabilities. To help those that are not security experts, a number of security organizations have 
established system-hardening guidelines and recommendations, which advise how to correct 
these weaknesses. 

Examples of sources for guidance on 
configuration standards include, but are not limited to: www.nist.gov, www.sans.org, and www.cisecurity.org, www.iso.org, and product vendors. 

System configuration standards must be kept up to date to ensure that newly identified weaknesses are corrected prior to a system being 
installed on the network. ","2.2.a Examine the organization’s system configuration standards for all types of system components and verify the system configuration standards are consistent with industryaccepted hardening standards. 

2.2.b Examine policies and interview personnel to verify that system configuration standards are updated as new vulnerability issues are identified, as defined in Requirement 6.1. 

2.2.c Examine policies and interview personnel to verify that system configuration standards are applied when new systems are configured and verified as being in place before a system is installed on the network. 

2.2.d Verify that system configuration standards include the following procedures for all types of system components: 

. Changing of all vendor-supplied defaults and elimination of unnecessary default accounts 
. Implementing only one primary function per server to prevent functions that require different security levels from co-existing on the same server 
. Enabling only necessary services, protocols, daemons, etc., as required for the function of the system 
. Implementing additional security features for any required services, protocols or daemons that are considered to be insecure 
. Configuring system security parameters to prevent misuse 
. Removing all unnecessary functionality, such as scripts, drivers, features, subsystems, file systems, and unnecessary web servers. "
PCI 02.2.1,"PCI 02.2.1: Implement only one primary function per server to prevent functions that require different security levels from co-existing on the same server. (For example, web servers, database servers, and DNS should be implemented on separate servers.)","If server functions that need different security levels are located on the same server, the security level of the functions with higher security needs would be reduced due to the presence of the lower-security functions. Additionally, the server functions with a lower security level may introduce security weaknesses to other functions on the same server. By considering the security needs of different server functions as part of the system configuration standards and related processes, organizations can ensure that functions requiring different security levels don’t co-exist on the same server. ","2.2.1.a Select a sample of system components and inspect the system configurations to verify that only one primary function is implemented per server. 

2.2.1.b If virtualization technologies are used, inspect the system configurations to verify that only one primary function is implemented per virtual system component or device. "
PCI 02.2.2,"PCI 02.2.2: Enable only necessary services, protocols, daemons, etc., as required for the function of the system.","As stated in Requirement 1.1.6, there are many protocols that a business may need (or have enabled by default) that are commonly used by malicious individuals to compromise a network. Including this requirement as part of an organization's configuration standards and related processes ensures that only the necessary services and protocols are enabled. ","2.2.2.a Select a sample of system components and inspect enabled system services, daemons, and protocols to verify that only necessary services or protocols are enabled. 

2.2.2.b Identify any enabled insecure services, daemons, or protocols and interview personnel to verify they are justified 
per documented configuration standards. "
