Requirement ,Description ,Guidance,Testing
PCI 09.9.2,"PCI 09.9.2: Periodically inspect device surfaces to detect tampering (for example, addition of card skimmers to devices), or substitution (for example, by checking the serial number or other device characteristics to verify it has not been swapped with...","Regular inspections of devices will help organizations to more quickly detect tampering or replacement of a device, and thereby minimize the potential impact of using fraudulent devices. 

The type of inspection will depend on the device—for example, photographs of devices that are known to be secure can be used to compare a device’s current appearance with its original appearance to see whether it has changed. Another option may be to use a secure marker pen, such as a UV light marker, to mark device surfaces and device openings so any tampering or replacement will be apparent. Criminals will often replace the outer casing of a device to hide their tampering, and these methods may help to detect such activities. Device vendors may also be able to provide security guidance and “how to” guides to help determine whether the device has been tampered with. 

The frequency of inspections will depend on factors such as location of device and whether the device is attended or unattended. For example, devices left in public areas without supervision by the organization’s personnel may have more frequent inspections than devices that are kept in secure areas or are supervised when they are accessible to the public. The type and frequency of inspections is determined by the merchant, as defined by their annual risk-assessment process. ","9.9.2.a Examine documented procedures to verify processes are defined to include the following: 

. Procedures for inspecting devices 
. Frequency of inspections. 

9.9.2.b Interview responsible personnel and observe inspection processes to verify: 

. Personnel are aware of procedures for inspecting devices. 
. All devices are periodically inspected for evidence of tampering and substitution. "
PCI 09.9.3,"PCI 09.9.3: Provide training for personnel to be aware of attempted tampering or replacement of devices. Training should include the following: . Verify the identity of any third-party persons claiming to be repair or maintenance personnel, prior to gr...","Criminals will often pose as authorized maintenance personnel in order to gain access to POS devices. All third parties requesting access to devices should always be verified before being provided access—for example, by checking with 
management or phoning the POS maintenance company (such as the vendor or acquirer) for verification. Many criminals will try to fool personnel by dressing for the part (for example, carrying toolboxes and dressed in work wear), and could also be knowledgeable about locations of devices, so it’s important personnel are trained to follow procedures at all times. 

Another trick criminals like to use is to send a “new” POS system with instructions for swapping it with a legitimate system and “returning” the legitimate system to a specified address. The criminals may 
even provide return postage as they are very keen to get their hands on these devices. Personnel always verify with their manager or supplier that the device is legitimate and came from a trusted source before installing it or using it for business. ","9.9.3.a Review training materials for personnel at point-of-sale locations to verify they include training in the following: 

. Verifying the identity of any third-party persons claiming to be repair or maintenance personnel, prior to granting them access to modify or troubleshoot devices 
. Not to install, replace, or return devices without verification 
. Being aware of suspicious behavior around devices (for example, attempts by unknown persons to unplug or open devices) 
. Reporting suspicious behavior and indications of device tampering or substitution to appropriate personnel (for example, to a manager or security officer). 

9.9.3.b Interview a sample of personnel at point-of-sale locations to verify they have received training and are aware of the procedures for the following: 

. Verifying the identity of any third-party persons claiming to be repair or maintenance personnel, prior to granting them access to modify or troubleshoot devices 
. Not to install, replace, or return devices without verification 
. Being aware of suspicious behavior around devices (for example, attempts by unknown persons to unplug or open devices) 
. Reporting suspicious behavior and indications of device tampering or substitution to appropriate personnel (for example, to a manager or security officer). 
"
PCI 1.1,PCI 01.1: Establish and implement firewall and router configuration standards that include the following:,"Firewalls and routers are key components of the architecture that controls entry to and exit from the network. These devices are software or hardware devices that block unwanted access and manage authorized access into and out of the network.

Configuration standards and procedures will help to ensure that the organization’s first line of defense in the protection of its data remains strong.",1.1 Inspect the firewall and router configuration standards and other documentation specified below and verify that standards are complete and implemented as follows:
PCI 1.2,PCI 01.2: Build firewall and router configurations that restrict connections between untrusted networks and any system components in the cardholder data environment. Note: An “untrusted network” is any network that is external to the networks belonging,"It is essential to install network protection between the internal, trusted network and any untrusted 
network that is external and/or out of the entity’s ability to control or manage. Failure to implement 
this measure correctly results in the entity being vulnerable to unauthorized access by malicious 
individuals or software. 

For firewall functionality to be effective, it must be properly configured to control and/or limit traffic into and out of the entity’s network.","1.2 Examine firewall and router configurations and perform the 
following to verify that connections are restricted between untrusted networks and system components in the cardholder 
data environment: "
PCI 1.3,PCI 01.3: Prohibit direct public access between the Internet and any system component in the cardholder data environment.,"A firewall's intent is to manage and control all connections between public systems and internal systems, especially those that store, process or 
transmit cardholder data. If direct access is allowed between public systems and the CDE, the
protections offered by the firewall are bypassed, and system components storing cardholder data may be exposed to compromise. ","1.3 Examine firewall and router configurations—including but not limited to the choke router at the Internet, the DMZ router and firewall, the DMZ cardholder segment, the perimeter router, 
and the internal cardholder network segment—and perform the following to determine that there is no direct access between the Internet and system components in the internal cardholder 
network segment: "
PCI 1.4,"PCI 01.4: Install personal firewall software on any mobile and/or employee-owned devices that connect to the Internet when outside the network (for example, laptops used by employees), and which are also used to access the network. Firewall configuration","Portable computing devices that are allowed to connect to the Internet from outside the corporate 
firewall are more vulnerable to Internet-based threats. Use of a personal firewall helps to protect 
devices from Internet-based attacks, which could use the device to gain access the organization’s 
systems and data once the device is re-connected to the network. 

The specific firewall configuration settings are determined by the organization. 

Note: The intent of this requirement applies to employee-owned and company-owned computers. Systems that cannot be managed by 
corporate policy introduce weaknesses to the perimeter and provide opportunities that malicious 
individuals may exploit. Allowing untrusted systems to connect to an organization’s network could result in access being granted to attackers and other malicious users. ","1.4.a Examine policies and configuration standards to verify: 

. Personal firewall software is required for all mobile and/or employee-owned devices that connect to the Internet (for 
example, laptops used by employees) when outside the network, and which are also used to access the network. 
. Specific configuration settings are defined for personal firewall software. 
. Personal firewall software is configured to actively run. 
. Personal firewall software is configured to not be alterable by users of mobile and/or employee-owned devices. 

1.4.b Inspect a sample of mobile and/or employee-owned devices to verify that: 

. Personal firewall software is installed and configured per the organization’s specific configuration settings. 
. Personal firewall software is actively running. 
. Personal firewall software is not alterable by users of mobile and/or employee-owned devices. "
PCI 1.5,"PCI 01.5: Ensure that security policies and operational procedures for managing firewalls are documented, in use, and known to all affected parties.","Personnel need to be aware of and following security policies and operational procedures to 
ensure firewalls and routers are continuously managed to prevent unauthorized access to the 
network. ","1.5 Examine documentation and interview personnel to verify that security policies and operational procedures for managing 
firewalls are: 

. Documented, 
. In use, and 
. Known to all affected parties. "
PCI 10,PCI 10: Track and monitor all access to network resources and cardholder data,,
PCI 10.1,PCI 10.1: Implement audit trails to link all access to system components to each individual user.,It is critical to have a process or system that links user access to system components accessed. This system generates audit logs and provides the ability to trace back suspicious activity to a specific user.,"10.1 Verify, through observation and interviewing the system administrator, that: 

. Audit trails are enabled and active for system components. 
. Access to system components is linked to individual users. "
PCI 10.2,PCI 10.2: Implement automated audit trails for all system components to reconstruct the following events:,"Generating audit trails of suspect activities alerts the system administrator, sends data to other monitoring mechanisms (like intrusion detection systems), and provides a history trail for post-incident follow-up. Logging of the following events enables an organization to identify and trace potentially malicious activities ","10.2 Through interviews of responsible personnel, observation of audit logs, and examination of audit log settings, perform the following: "
PCI 10.2.1,PCI 10.2.1: All individual user accesses to cardholder data,"Malicious individuals could obtain knowledge of a user account with access to systems in the CDE, or they could create a new, unauthorized account in order to access cardholder data. A record of all 
individual accesses to cardholder data can identify which accounts may have been compromised or misused. ",10.2.1 Verify all individual access to cardholder data is logged.
PCI 10.2.2,PCI 10.2.2: All actions taken by any individual with root or administrative privileges,"Accounts with increased privileges, such as the “administrator” or “root” account, have the potential to greatly impact the security or operational functionality of a system. Without a log of the activities performed, an organization is unable to trace any issues resulting from an administrative mistake or misuse of privilege back to the specific action and individual. ",10.2.2 Verify all actions taken by any individual with root or administrative privileges are logged.
PCI 10.2.3,PCI 10.2.3: Access to all audit trails,"Malicious users often attempt to alter audit logs to hide their actions, and a record of access allows an organization to trace any inconsistencies or potential tampering of the logs to an individual account. Having access to logs identifying changes, additions, and deletions can help retrace 
steps made by unauthorized personnel. ",10.2.3 Verify access to all audit trails is logged.
PCI 10.2.4,PCI 10.2.4: Invalid logical access attempts,Malicious individuals will often perform multiple access attempts on targeted systems. Multiple invalid login attempts may be an indication of an unauthorized user’s attempts to “brute force” or guess a password.,10.2.4 Verify invalid logical access attempts are logged.
PCI 10.2.5,"PCI 10.2.5: Use of and changes to identification and authentication mechanisms—including but not limited to creation of new accounts and elevation of privileges—and all changes, additions, or deletions to accounts with root or administrative privileges","Without knowing who was logged on at the time of an incident, it is impossible to identify the accounts that may have been used. Additionally, malicious users may attempt to manipulate the authentication controls with the intent of bypassing them or impersonating a valid account. ","10.2.5.a Verify use of identification and authentication mechanisms is logged.

10.2.5.b Verify all elevation of privileges is logged. 

10.2.5.c Verify all changes, additions, or deletions to any account with root or administrative privileges are logged. "
PCI 10.2.6,"PCI 10.2.6: Initialization, stopping, or pausing of the audit logs",Turning the audit logs off (or pausing them) prior to performing illicit activities is a common practice for malicious users wishing to avoid detection. Initialization of audit logs could indicate that the log function was disabled by a user to hide their actions.,"10.2.6 Verify the following are logged: 

. Initialization of audit logs 
. Stopping or pausing of audit logs. "
PCI 10.2.7,PCI 10.2.7: Creation and deletion of system-level objects,"Malicious software, such as malware, often 
creates or replaces system level objects on the target system in order to control a particular function or operation on that system. By logging when system-level objects, such as database tables or stored procedures, are created or deleted, it will be easier to determine whether such modifications were authorized. ",10.2.7 Verify creation and deletion of system level objects are logged.
PCI 10.3,PCI 10.3: Record at least the following audit trail entries for all system components for each event:,"By recording these details for the auditable events at 10.2, a potential compromise can be quickly identified, and with sufficient detail to know who, what, where, when, and how. ","10.3 Through interviews and observation of audit logs, for each auditable event (from 10.2), perform the following: "
PCI 10.3.1,PCI 10.3.1: User identification,,10.3.1 Verify user identification is included in log entries.
PCI 10.3.2,PCI 10.3.2: Type of event,,10.3.2 Verify type of event is included in log entries.
PCI 10.3.3,PCI 10.3.3: Date and time,,10.3.3 Verify date and time stamp is included in log entries.
PCI 10.3.4,PCI 10.3.4: Success or failure indication,,10.3.4 Verify success or failure indication is included in log entries.
PCI 10.3.5,PCI 10.3.5: Origination of event,,10.3.5 Verify origination of event is included in log entries.
PCI 10.3.6,"PCI 10.3.6: Identity or name of affected data, system component, or resource.",,"10.3.6 Verify identity or name of affected data, system component, or resources is included in log entries. "
PCI 10.4,"PCI 10.4: Using time-synchronization technology, synchronize all critical system clocks and times and ensure that the following is implemented for acquiring, distributing, and storing time. Note: One example of time synchronization technology is Networ...","Time synchronization technology is used to synchronize clocks on multiple systems. When clocks are not properly synchronized, it can be difficult, if not impossible, to compare log files from different systems and establish an exact sequence of event (crucial for forensic analysis in the event of a breach). For post-incident forensics teams, the accuracy and consistency of time across all systems and the time of each activity is critical in determining how the systems were compromised. ",10.4 Examine configuration standards and processes to verify that time-synchronization technology is implemented and kept current per PCI DSS Requirements 6.1 and 6.2.
PCI 10.4.1,PCI 10.4.1: Critical systems have the correct and consistent time.,,"10.4.1.a Examine the process for acquiring, distributing and storing the correct time within the organization to verify that: 

. Only the designated central time server(s) receives time signals from external sources, and time signals from external sources are based on International Atomic Time or UTC. 
. Where there is more than one designated time server, the time servers peer with one another to keep accurate time, 
. Systems receive time information only from designated central time server(s).

10.4.1.b Observe the time-related system-parameter settings for a sample of system components to verify: 

. Only the designated central time server(s) receives time signals from external sources, and time signals from external sources are based on International Atomic Time or UTC. 
. Where there is more than one designated time server, the designated central time server(s) peer with one another to keep accurate time. 
. Systems receive time only from designated central time server(s). 
"
PCI 10.4.2,PCI 10.4.2: Time data is protected.,,"10.4.2.a Examine system configurations and time-
synchronization settings to verify that access to time data is restricted to only personnel with a business need to access time data. 

10.4.2.b Examine system configurations, time synchronization settings and logs, and processes to verify that any changes to time settings on critical systems are logged, monitored, and reviewed."
PCI 10.4.3,PCI 10.4.3: Time settings are received from industry-accepted time sources.,,"10.4.3 Examine systems configurations to verify that the time server(s) accept time updates from specific, industry-accepted external sources (to prevent a malicious individual from changing the clock). Optionally, those updates can be encrypted with a 
symmetric key, and access control lists can be created that specify the IP addresses of client machines that will be provided with the time updates (to prevent unauthorized use of internal 
time servers). "
PCI 10.5,PCI 10.5: Secure audit trails so they cannot be altered.,"Often a malicious individual who has entered the network will attempt to edit the audit logs in order to hide their activity. Without adequate protection of audit logs, their completeness, accuracy, and integrity cannot be guaranteed, and the audit logs 
can be rendered useless as an investigation tool after a compromise. ",10.5 Interview system administrators and examine system configurations and permissions to verify that audit trails are secured so that they cannot be altered as follows:
PCI 10.5.1,PCI 10.5.1: Limit viewing of audit trails to those with a job-related need.,"Adequate protection of the audit logs includes strong access control (limit access to logs based on “need to know” only), and use of physical or network segregation to make the logs harder to find and modify. 

Promptly backing up the logs to a centralized log server or media that is difficult to alter keeps the logs protected even if the system generating the 
logs becomes compromised. ","10.5.1 Only individuals who have a job-related need can view audit trail files. 
"
PCI 10.5.2,PCI 10.5.2: Protect audit trail files from unauthorized modifications.,,"10.5.2 Current audit trail files are protected from unauthorized modifications via access control mechanisms, physical segregation, and/or network segregation. "
PCI 10.5.3,PCI 10.5.3: Promptly back up audit trail files to a centralized log server or media that is difficult to alter.,,10.5.3 Current audit trail files are promptly backed up to a centralized log server or media that is difficult to alter.
PCI 10.5.4,"PCI 10.5.4: Write logs for external-facing technologies onto a secure, centralized, internal log server or media device.","By writing logs from external-facing technologies such as wireless, firewalls, DNS, and mail servers, the risk of those logs being lost or altered is lowered, as they are more secure within the internal network. 

Logs may be written directly, or offloaded or copied from external systems, to the secure internal system or media. ","10.5.4 Logs for external-facing technologies (for example, wireless, firewalls, DNS, mail) are written onto a secure, centralized, internal log server or media. "
PCI 10.5.5,PCI 10.5.5: Use file-integrity monitoring or change-detection software on logs to ensure that existing log data cannot be changed without generating alerts (although new data being added should not cause an alert).,"File-integrity monitoring or change-detection systems check for changes to critical files, and notify when such changes are noted. For file-integrity monitoring purposes, an entity usually monitors files that don’t regularly change, but when changed indicate a possible compromise. ","10.5.5 Examine system settings, monitored files, and results from monitoring activities to verify the use of file-integrity monitoring or change-detection software on logs. "
PCI 10.6,"PCI 10.6: Review logs and security events for all system components to identify anomalies or suspicious activity. Note: Log harvesting, parsing, and alerting tools may be used to meet this Requirement.","Many breaches occur over days or months before being detected. Checking logs daily minimizes the amount of time and exposure of a potential breach. 

Regular log reviews by personnel or automated means can identify and proactively address unauthorized access to the cardholder data environment. 

The log review process does not have to be manual. The use of log harvesting, parsing, and alerting tools can help facilitate the process by identifying log events that need to be reviewed. 
",10.6 Perform the following:
PCI 10.6.1,"PCI 10.6.1: Review the following at least daily: . All security events . Logs of all system components that store, process, or transmit CHD and/or SAD, or that could impact the security of CHD and/or SAD . Logs of all critical system components . Logs o","Many breaches occur over days or months before being detected. Checking logs daily minimizes the amount of time and exposure of a potential breach. 

Daily review of security events—for example, notifications or alerts that identify suspicious or anomalous activities—as well as logs from critical system components, and logs from systems that perform security functions, such as firewalls, IDS/IPS, file-integrity monitoring (FIM) systems, etc. is necessary to identify potential issues. Note that the determination of “security event” will vary 
for each organization and may include consideration for the type of technology, location, and function of the device. Organizations may also wish to maintain a baseline of “normal” traffic to help identify anomalous behavior. ","10.6.1.a Examine security policies and procedures to verify that procedures are defined for reviewing the following at least daily, either manually or via log tools: 

. All security events 
. Logs of all system components that store, process, or transmit CHD and/or SAD, or that could impact the security of CHD and/or SAD 
. Logs of all critical system components 
. Logs of all servers and system components that perform security functions (for example, firewalls, intrusion-detection systems/intrusion-prevention systems (IDS/IPS), authentication servers, e-commerce redirection servers, etc.) 

10.6.1.b Observe processes and interview personnel to verify that the following are reviewed at least daily: 

. All security events 
. Logs of all system components that store, process, or transmit CHD and/or SAD, or that could impact the security of CHD and/or SAD 
. Logs of all critical system components 
. Logs of all servers and system components that perform security functions (for example, firewalls, intrusion-detection systems/intrusion-prevention systems (IDS/IPS), authentication servers, e-commerce redirection servers, etc.). "
PCI 10.6.2,"PCI 10.6.2: Review logs of all other system components periodically based on the organization’s policies and risk management strategy, as determined by the organization’s annual risk assessment.","Logs for all other system components should also be periodically reviewed to identify indications of potential issues or attempts to gain access to sensitive systems via less-sensitive systems. The frequency of the reviews should be determined by 
an entity’s annual risk assessment. ","10.6.2.a Examine security policies and procedures to verify that procedures are defined for reviewing logs of all other system components periodically—either manually or via log tools—based on the organization’s policies and risk management strategy. 

10.6.2.b Examine the organization’s risk-assessment 
documentation and interview personnel to verify that reviews are performed in accordance with organization’s policies and risk management strategy. "
